{
  "$schema": "../../../../../../docs/packs/schema/about.schema.json",
  "status": "draft",
  "description": "Kilugbara ni lugha ya Kisudani ya Kati inayozungumzwa na watu takriban milioni mbili katika West Nile, karibu na Arua, Koboko, Maracha na Terego, na kaskazini-mashariki mwa Kongo.",
  "notes": "Drafted by Claude (AI) for the Lugbara courses (#132) with low confidence in Lugbara; needs a native-speaker review. The Swahili needs a native-speaker review too; word and unit notes fall back to the English notes (lang/en/about/lgg).",
  "landing": {
    "hello": "Mi ngoni",
    "thanks": "Awa’difo",
    "place": "West Nile",
    "word": "imba — kujifunza",
    "words": [
      ["Mi ngoni?", "Habari?"],
      ["Ma muke", "Nzuri"],
      ["Awa’difo", "Asante"],
      ["Mi emu muke", "Karibu"],
      ["Agyi", "Rafiki"],
      ["Ii", "Maji"],
      ["Nyaka", "Chakula"],
      ["Ati", "Bwana"],
      ["Andre", "Bibi"],
      ["Mi mu muke", "Kwaheri"]
    ],
    "why": {
      "title": "Lugha ya **Arua, Koboko na mlima Wati.**",
      "text": "Kilugbara ni ndugu wa Kimadi, Kiaringa na Kilogo, familia ya lugha za Kisudani ya Kati kutoka Uganda hadi Kongo na Sudan Kusini. Jifunze kwa ajili ya familia, safari, kazi, na nyimbo, ngoma na hadithi za West Nile.",
      "cards": [
        { "title": "Kwa familia", "text": "Ongea na babu, bibi na ndugu huko Arua na Koboko." },
        { "title": "Kwa wasafiri", "text": "Safiri kutoka Arua hadi Koboko, Nebbi na mlima Wati." },
        { "title": "Kwa wadadisi", "text": "Gundua lugha ya toni isiyo na ngeli za majina wala viambishi vya vitenzi." }
      ]
    },
    "sample": {
      "prompt": "Lipi lina maana ya “asante”?",
      "options": ["Mi ngoni?", "Awa’difo", "Ku"],
      "answer": "Awa’difo",
      "explain": "_Awa’difo_ maana yake ni asante."
    },
    "start": { "word": "Ama eto!", "caption": "ama eto — tuanze" },
    "farewell": "Awa’difo amboni — asante sana.",
    "audience": "Wanaoanza kabisa, familia za West Nile, wajitolea na wasafiri wanaoelekea Arua.",
    "first": "Salamu, kujitambulisha na namba, kisha familia, chakula, sokoni, saa, mahali, nyumbani na afya, kipengele kwa kipengele."
  },
  "cast": { "emma": "Mgeni anayejifunza Kilugbara kabla ya safari yake" }
}
