{
  "$schema": "../../../../../../docs/packs/schema/about.schema.json",
  "status": "draft",
  "description": "Leb Swahili obedo leb me Afrika me Wokceng, ma dano milion mapol loko cakke ki Mombasa ki Zanzibar cito wa Kampala, Kigali ki Goma.",
  "notes": "Drafted by Claude (AI) for the Acholi courses (#130) with low confidence in Acholi; needs a native-speaker review. Word and unit notes fall back to the English notes about the target language.",
  "landing": {
    "hello": "Habari?",
    "thanks": "Asante",
    "place": "East Africa",
    "word": "kujifunza — pwonye",
    "words": [
      ["Habari?", "Itye nining?"],
      ["Nzuri", "Maber"],
      ["Asante", "Apwoyo"],
      ["Karibu", "Wajoli"],
      ["Rafiki", "Lawot"],
      ["Maji", "Pii"],
      ["Chakula", "Cam"],
      ["Pole pole", "Mot mot"],
      ["Hakuna shida", "Peko pe"],
      ["Kwaheri", "Bed maber"]
    ],
    "why": {
      "title": "Leb me **Afrika me Wokceng ducu.**",
      "text": "Leb Swahili obedo leb me lobo i Kenya, Tanzania ki Uganda, dok giloko kwede i cat ki wil cakke ki dog nam cito wa Congo. Pwonye me wot, cat, nongo lurem ki winyo wer, cakke ki taarab cito wa bongo flava.",
      "cards": [
        { "title": "Pi luwot", "text": "Wot cakke ki Mombasa cito wa Mwanza i matatu, daladala onyo i yeya." },
        { "title": "I tic", "text": "Lok ki lutic ki luwil i lobo ducu." },
        { "title": "Pi jo ma mito ngeyo", "text": "Nong kit nying, carolok ki wer me dog nam ma con." }
      ]
    },
    "sample": {
      "prompt": "Lok mene ma tyen lok ne “apwoyo”?",
      "options": ["Habari?", "Asante", "Hapana"],
      "answer": "Asante",
      "explain": "_Asante_ tyen lok ne apwoyo."
    },
    "start": { "word": "Tuanze!", "caption": "tuanze — wacak" },
    "farewell": "Asante sana — apwoyo matek.",
    "audience": "Jo ma loko Leb Acoli ma gicako manyen: luwot, lucat ki lutic i Afrika me Wokceng, ki lukwan ma maro Leb Swahili.",
    "first": "Moto, tito nyingi ki kwan wel, lacen dog gang, cam, cuk, cawa, kabedo, gang ki yot kom, dul ki dul."
  },
  "cast": { "emma": "Welo ma oa ki lobo mukene ma tye ka pwonye Leb Swahili calo in" }
}
