{
  "$schema": "../../../../../../docs/packs/schema/about.schema.json",
  "status": "draft",
  "description": "Olufalansa lwogerwa ku semazinga zona itaano, okuva e Paris ne Montreal okutuuka e Kinshasa, Dakar ne Abidjan, era abasinga okulwogera bali mu Afrika.",
  "notes": "Drafted by Claude (AI) for the Lusoga courses (#129) from the Luganda text, with low confidence in Lusoga; needs a native-speaker review.",
  "landing": {
    "hello": "Bonjour !",
    "thanks": "Merci",
    "place": "ensi ezoogera Olufalansa",
    "word": "apprendre — okuyiga (ekikolwa)",
    "words": [
      ["Bonjour", "Oli otya"],
      ["Ça va ?", "Biki?"],
      ["Merci", "Weebale"],
      ["D’accord", "Kale"],
      ["Ami", "Mukwano"],
      ["Eau", "Amaadhi"],
      ["Nourriture", "Emere"],
      ["Monsieur", "Sebo"],
      ["Madame", "Nyabo"],
      ["Au revoir", "Weeraba"]
    ],
    "why": {
      "title": "Olulimi lw’**ensi dh’Afirika nyingi, n’okusingawo.**",
      "text": "Olufalansa lulimi lwa gwanga mu nsi za Afrika ezisuka mu abiri, okuva e Senegal okutuuka e Congo, ne mu baliraanwa ba Uganda, Rwanda ne Burundi. Luyige otambule, osome, okole emirimu okusuka ensalo era onyumirwe enyimba, okuva ku rumba okutuuka ku coupé-décalé.",
      "cards": [
        { "title": "Eri abatambuze", "text": "Tambula okuva e Kigali okutuuka e Kinshasa, Dakar oba Paris." },
        { "title": "Ku mulimu", "text": "Suubula, soma era okole n’abantu mu Afrika yona eyoogera Olufalansa." },
        { "title": "Eri abaagala okumanya", "text": "Zuula amanya ag’ekikazi n’ekisadha, enukuta ezitasomebwa n’enamba ezeewuunyisa." }
      ]
    },
    "sample": {
      "prompt": "Kigambo ki ekitegeeza “weebale”?",
      "options": ["Bonjour", "Merci", "Non"],
      "answer": "Merci",
      "explain": "_Merci_ kitegeeza weebale."
    },
    "start": { "word": "C’est parti !", "caption": "c’est parti — ka tutandike nno" },
    "farewell": "Merci beaucoup — weebale inho.",
    "audience": "Aboogera Olusoga abatandika okuva ku ntandikwa: abayizi, abatambuze n’abasuubuzi abagenda mu nsi ezoogera Olufalansa.",
    "first": "Okulamusa, okwenyanjula n’enamba, oluvanyuma ab’omu maka, emere, akatale, esaawa, ebifo, awaka n’obulamu, ekitundu ku kitundu."
  },
  "cast": { "emma": "Omugenyi okuva ebweru ayogera Olufalansa" }
}
