{
  "$schema": "../../../../../../docs/packs/schema/about.schema.json",
  "status": "draft",
  "description": "Le français est parlé sur les cinq continents, de Paris et Montréal à Kinshasa, Dakar et Abidjan, et la plupart de ses locuteurs vivent en Afrique.",
  "notes": "Drafted by Claude (AI) for the French courses (#145); needs a native-speaker review.",
  "landing": {
    "hello": "Bonjour !",
    "thanks": "Merci",
    "place": "le monde francophone",
    "word": "apprendre — v. acquérir des connaissances",
    "words": [
      ["Bonjour", "salutation"],
      ["Ça va ?", "question amicale"],
      ["Merci", "remerciement"],
      ["D’accord", "accord"],
      ["Ami", "camarade"],
      ["Eau", "boisson"],
      ["Nourriture", "repas"],
      ["Monsieur", "homme"],
      ["Madame", "femme"],
      ["Au revoir", "adieu"]
    ],
    "why": {
      "title": "Une langue pour **la moitié de l’Afrique, et au-delà.**",
      "text": "Le français est langue officielle dans plus de vingt pays africains, du Sénégal à la République démocratique du Congo, et chez les voisins de l’Ouganda, le Rwanda et le Burundi. Apprends-le pour voyager, étudier, travailler par-delà les frontières et profiter de la musique, de la rumba au coupé-décalé.",
      "cards": [
        { "title": "Pour les voyageurs", "text": "Trouve ton chemin de Kigali à Kinshasa, Dakar ou Paris." },
        { "title": "Pour le travail", "text": "Commerce, études et partenaires dans toute l’Afrique francophone." },
        { "title": "Pour les curieux", "text": "Découvre le genre des noms, les lettres muettes et quelques nombres surprenants." }
      ]
    },
    "sample": {
      "prompt": "Lequel veut dire « merci » ?",
      "options": ["Bonjour", "Merci", "Non"],
      "answer": "Merci",
      "explain": "_Merci_ sert à remercier."
    },
    "start": { "word": "C’est parti !", "caption": "c’est parti — on commence" },
    "farewell": "Merci beaucoup !",
    "audience": "Les grands débutants, les élèves et les voyageurs qui partent en Afrique francophone ou en Europe, et tous ceux qui veulent parler avec leurs voisins francophones.",
    "first": "Salutations, présentations et nombres, puis la famille, la nourriture, le marché, l’heure, les lieux, la maison et la santé, unité par unité."
  },
  "cast": { "emma": "Une visiteuse étrangère qui parle français" }
}
