{
  "$schema": "../../../../../../docs/packs/schema/about.schema.json",
  "status": "draft",
  "description": "Olusoga lwogerwa abantu obukadde nga busatu mu Busoga, ebuvanjuba bwa Uganda, wakati w’ennyanja Nalubaale, omugga Kiyira n’ennyanja Kyoga, nga Jinja n’ensibuko ya Kiyira bye biri wakati.",
  "notes": "Drafted by Claude (AI) for the Lusoga courses (#129) with low confidence in Lusoga; needs a native-speaker review. The Luganda needs a native-speaker review too; word and unit notes fall back to the English notes (lang/en/about/xog).",
  "landing": {
    "hello": "Oli otya?",
    "thanks": "Weebale",
    "place": "Busoga",
    "word": "okuyiga — okuyiga",
    "words": [
      ["Inho", "Nnyo"],
      ["Atyanu", "Kati"],
      ["Lero", "Leero"],
      ["Idho", "Jjo"],
      ["Amaadhi", "Amazzi"],
      ["Emere", "Emmere"],
      ["Iwe", "Ggwe"],
      ["Ikumi", "Kkumi"],
      ["Nsangaire", "Nsanyuse"],
      ["Tulibonagana", "Tunaalabagana"]
    ],
    "why": {
      "title": "Olulimi lwa **Busoga n’ensibuko ya Kiyira.**",
      "text": "Olusoga lwe lulimi lw’e Jinja, Iganga, Kamuli ne Mayuge, era lufaanana nnyo Oluganda, kale bw’oluyiga omanya ebingi eby’ebuvanjuba bwa Uganda. Luyige olw’ab’omu maka, entambula, emirimu n’ennyimba n’engero za Busoga.",
      "cards": [
        { "title": "Eri ab’omu maka", "text": "Yogera ne bajjajja n’ab’eŋŋanda mu Busoga." },
        { "title": "Eri abatambuze", "text": "Tambula okuva e Jinja okutuuka ku Bujagali ne ku kizinga Buvuma." },
        { "title": "Eri abaagala okumanya", "text": "Zuula ebika by’amannya n’ebigambo ebingi Olusoga bye lugabana n’Oluganda." }
      ]
    },
    "sample": {
      "prompt": "Kiruwa ekitegeeza “weebale”?",
      "options": ["Oli otya?", "Weebale", "Nedda"],
      "answer": "Weebale",
      "explain": "_Weebale_ kitegeeza weebale."
    },
    "start": { "word": "Tutandike!", "caption": "tutandike — ka tutandike" },
    "farewell": "Weebale inho — weebale nnyo.",
    "audience": "Aboogera Oluganda abatandika okuva ku ntandikwa, ab’omu maka abava mu Busoga, n’abatambuze abagenda ebuvanjuba bwa Uganda.",
    "first": "Okulamusa, okweyanjula n’ennamba, oluvannyuma ab’omu maka, emmere, akatale, essaawa, ebifo, awaka n’obulamu, ekitundu ku kitundu."
  },
  "cast": { "emma": "Omugenyi ayiga Olusoga nga tannaba kutambula" }
}
