{
  "$schema": "../../../../../../docs/packs/schema/about.schema.json",
  "status": "draft",
  "description": "Swahiliti ni East Africa e’yo, ba ambo ndra a’yo ni Mombasa ka Zanzibar ni ani Kampala, Kigali ka Goma.",
  "notes": "Drafted by Claude (AI) for the Lugbara courses (#132) with low confidence in Lugbara; needs a native-speaker review. Word and unit notes fall back to the English notes about the target language.",
  "landing": {
    "hello": "Habari?",
    "thanks": "Asante",
    "place": "East Africa",
    "word": "kujifunza — imba",
    "words": [
      ["Habari?", "Mi ngoni?"],
      ["Nzuri", "Muke"],
      ["Asante", "Awa’difo"],
      ["Karibu", "Mi emu muke"],
      ["Rafiki", "Agyi"],
      ["Maji", "Ii"],
      ["Chakula", "Nyaka"],
      ["Pole pole", "Tre tre"],
      ["Hakuna shida", "E’yo ovu ku"],
      ["Kwaheri", "Mi mu muke"]
    ],
    "why": {
      "title": "E’yo **East Africa dria ni.**",
      "text": "Swahiliti ni e’yo Kenya, Tanzania ka Uganda ni, ba a’yo suku alia ka azi vu ii amboa gere ni ani Congo. Imba geri ndizu ni, biasara ni, agyi ndrezu ni ka ongo erizu ni.",
      "cards": [
        { "title": "Ba ndi geri dria ni", "text": "Ndi Mombasa ni ani Mwanza takisi ya jahazi ya si." },
        { "title": "Azi vu", "text": "Azi ngu ozi bayi ka ogu bayi be East Africa dria." },
        { "title": "Ba le e’yo ni ni", "text": "Ndre e’yo ati, e’yo ndra’bo niyi ka ongoyi ii amboa gere ni." }
      ]
    },
    "sample": { "prompt": "Ngo ni “awa’difo”?", "options": ["Habari?", "Asante", "Hapana"], "answer": "Asante", "explain": "_Asante_ ni awa’difo." },
    "start": { "word": "Tuanze!", "caption": "tuanze — ama eto" },
    "farewell": "Asante sana — awa’difo amboni.",
    "audience": "Ba Lugbarati a’yo ni etozu ni: ba ndi geri dria ni, ozi bayi ka azi bayi East Africa alia.",
    "first": "Ngoni, ru a’yozu ka nde, vutia aku ba, nyaka, suku, sawa, vu, jo ka ruakini, alu alu."
  },
  "cast": { "emma": "Uji imba Swahiliti mi ndi" }
}
