{
  "$schema": "../../../../../../docs/packs/schema/about.schema.json",
  "status": "draft",
  "description": "Acoli ka akiro ka Luo ŋina erworete itunga ŋulu ipu kotoma Gulu, Kitgum ka Pader, ka kotoma South Sudan.",
  "notes": "Drafted by Claude (AI) for the Ateso courses (#131) with low confidence in Ateso; needs a native-speaker review. Word and unit notes fall back to the English notes about the target language.",
  "landing": {
    "hello": "Itye nining?",
    "thanks": "Apwoyo",
    "place": "Acholi land",
    "word": "pwonye — akisisianakin",
    "words": [
      ["Itye nining?", "Ijai bo?"],
      ["Atye maber", "Ejai ejok"],
      ["Apwoyo", "Eyalama"],
      ["Wajoli", "Kobuka"],
      ["Lawot", "Ekone"],
      ["Pii", "Akipi"],
      ["Cam", "Akimuj"],
      ["Ladit", "Lokapolon"],
      ["Mego", "Toto"],
      ["Bed maber", "Kolosi ejok"]
    ],
    "why": {
      "title": "Akiro ka **Gulu, Kitgum ka Acoli kere.**",
      "text": "Acoli erworete kotoma Gulu, Kitgum ka Pader, ka epoloi Alango, Alur ka Ajaluo ka Kenya. Kisisianakin kanuka ekal, elosit, aswam, ka isuban, ailip ka ailimor ka Acoli.",
      "cards": [
        { "title": "Kanuka ekal", "text": "Kirwor ka ikapolok ka ikaitotak kotoma Gulu ka Kitgum." },
        { "title": "Kanuka ikalosak", "text": "Kilosi kiŋaren Soroti tetere Lira, Gulu ka Kitgum." },
        { "title": "Kanuka ŋulu emina ajenun", "text": "Kiriamu akiro ka Luo ŋina mam ejaasi ŋakekan ka ŋakiro." }
      ]
    },
    "sample": {
      "prompt": "Ŋai eteteuni “eyalama”?",
      "options": ["Itye nining?", "Apwoyo", "Pe"],
      "answer": "Apwoyo",
      "explain": "_Apwoyo_ eteteuni eyalama."
    },
    "start": { "word": "Wacak!", "caption": "wacak — kiŋarenata oni" },
    "farewell": "Apwoyo matek — eyalama noi.",
    "audience": "Itunga ŋulu erworete Ateso ŋulu ekiŋaren, ikalia ŋulu elomete Acoli, ka ikalosak ŋulu elosete Gulu.",
    "first": "Ayakuno, aitodiaar ka ikarin, kau ekal, akimuj, ekeya, apak, ŋiboro, etogo ka ajokus ka akwaŋan, aitodolet ka aitodolet."
  },
  "cast": { "emma": "Ekaitoŋaon ŋesi esisianakini Acoli kiŋaren elosit" }
}
