{
  "$schema": "../../../../../../docs/packs/schema/about.schema.json",
  "status": "draft",
  "description": "Basogati ni e’yo ba Busoga ni, Uganda ngaa vu, Eyi Nile eto vu Jinja ngbangba.",
  "notes": "Drafted by Claude (AI) for the Lugbara courses (#132) with low confidence in Lugbara; needs a native-speaker review. Word and unit notes fall back to the English notes about the target language.",
  "landing": {
    "hello": "Oli otya?",
    "thanks": "Weebale",
    "place": "Busoga",
    "word": "okuyiga — imba",
    "words": [
      ["Inho", "Ndra"],
      ["Atyanu", "Ndraa"],
      ["Lero", "Ndrani"],
      ["Idho", "Ndrozi"],
      ["Amaadhi", "Ii"],
      ["Emere", "Nyaka"],
      ["Iwe", "Mi"],
      ["Ikumi", "Mudri"],
      ["Nsangaire", "Ma asi muke"],
      ["Tulibonagana", "Ama ka ndre vutia"]
    ],
    "why": {
      "title": "E’yo **Busoga ka Eyi Nile eto vu ni.**",
      "text": "Basogati ni e’yo Jinja, Iganga, Kamuli ka Mayuge ni, eri ovu Bagandati ndi, te eri ere. Imba aku ba ni, geri ndizu ni, azi ni, ka ongo Busoga ni.",
      "cards": [
        { "title": "Aku ba ni", "text": "A’yo atibi ka aku bayi be Busoga alia." },
        { "title": "Ba ndi geri dria ni", "text": "Ndi Jinja ni ani Bujagali ka Buvuma." },
        { "title": "Ba le e’yo ni ni", "text": "Ndre e’yoyi Basogati ka Bagandati ere ni." }
      ]
    },
    "sample": {
      "prompt": "Ngo ni “awa’difo”?",
      "options": ["Oli otya?", "Weebale", "Nedda"],
      "answer": "Weebale",
      "explain": "_Weebale_ ni awa’difo."
    },
    "start": { "word": "Tutandike!", "caption": "tutandike — ama eto" },
    "farewell": "Weebale inho — awa’difo amboni.",
    "audience": "Ba Lugbarati a’yo ni etozu ni, aku bayi emu Busoga ni, ka ba ndi Jinja.",
    "first": "Ngoni, ru a’yozu ka nde, vutia aku ba, nyaka, suku, sawa, vu, jo ka ruakini, alu alu."
  },
  "cast": { "emma": "Uji imba Basogati ndi geri dria ndraa" }
}
