{
  "$schema": "../../../../../../docs/packs/schema/about.schema.json",
  "status": "draft",
  "description": "Kisoga huzungumzwa na watu wapatao milioni tatu katika Busoga, mashariki mwa Uganda, kati ya Ziwa Viktoria, Mto Nile na Ziwa Kyoga, Jinja na chanzo cha Nile vikiwa katikati yake.",
  "notes": "Drafted by Claude (AI) for the Lusoga courses (#129) with low confidence in Lusoga; needs a native-speaker review. The Swahili needs a native-speaker review too; word and unit notes fall back to the English notes (lang/en/about/xog).",
  "landing": {
    "hello": "Oli otya?",
    "thanks": "Weebale",
    "place": "Busoga",
    "word": "okuyiga — kujifunza",
    "words": [
      ["Inho", "Sana"],
      ["Atyanu", "Sasa"],
      ["Lero", "Leo"],
      ["Idho", "Jana"],
      ["Amaadhi", "Maji"],
      ["Emere", "Chakula"],
      ["Iwe", "Wewe"],
      ["Ikumi", "Kumi"],
      ["Nsangaire", "Nimefurahi"],
      ["Tulibonagana", "Tutaonana"]
    ],
    "why": {
      "title": "Lugha ya **Busoga na chanzo cha Nile.**",
      "text": "Kisoga ni lugha ya Jinja, Iganga, Kamuli na Mayuge, na kinakaribiana sana na Kiganda, hivyo kinakufungulia sehemu kubwa ya mashariki na kati ya Uganda. Jifunze kwa ajili ya familia, safari, kazi na nyimbo na hadithi za Busoga.",
      "cards": [
        { "title": "Kwa familia", "text": "Ongea na babu, bibi na ndugu walioko Busoga." },
        { "title": "Kwa wasafiri", "text": "Safiri kutoka Jinja hadi maporomoko ya Bujagali na kisiwa cha Buvuma." },
        { "title": "Kwa wadadisi", "text": "Gundua ngeli za nomino, irabu ndefu na maneno mengi ambayo Kisoga kinashiriki na Kiganda." }
      ]
    },
    "sample": {
      "prompt": "Ipi ina maana ya “asante”?",
      "options": ["Oli otya?", "Weebale", "Nedda"],
      "answer": "Weebale",
      "explain": "_Weebale_ maana yake ni asante."
    },
    "start": { "word": "Tutandike!", "caption": "tutandike — tuanze" },
    "farewell": "Weebale inho — asante sana.",
    "audience": "Wanaoanza kabisa, familia kutoka Busoga, wanaojitolea na wasafiri wanaoelekea mashariki mwa Uganda.",
    "first": "Salamu, kujitambulisha na namba, kisha familia, chakula, sokoni, saa, mahali, nyumbani na afya, kipengele kwa kipengele."
  },
  "cast": { "emma": "Mgeni anayejifunza Kisoga kabla ya safari yake" }
}
